External Identifier,Resource Name,Description,Subject Webpage,Life Cycle Status Type,Language,Accommodation Type,Support Service Type,Delivery Type,Keywords,Offered By
uiuc_ss_02,Library,"The University Library is one of the largest public university collections in the world. Students have access to thousands of computer terminals in classrooms, residence halls, and campus libraries for use in classroom instruction, study, and research.",https://www.library.illinois.edu/,Active,english,AssistiveTechnology,LearningResourceProvision,BlendedDelivery,library | research | study | books | articles | journals | media | assistive technology,same as owner
uiuc_ss_03,Disability Resources & Educational Services (DRES),"DRES ensures that qualified individuals with disabilities are afforded an equal opportunity to participate in and benefit from the programs, services, and activities of the University of Illinois at Urbana-Champaign.",https://www.disability.illinois.edu/,Active,english,PhysicalAccessibility | AccessibleHousing | AccessibleParking | AssistiveTechnology | Communication | DietaryAccommodation | FlexibleSchedule | Sensory | ServiceAnimal,AssistiveTechnologySupport | DiversityEquityInclusion,BlendedDelivery,disability resources | educational services | accessibility | accommodations,same as owner
uiuc_ss_04,Chez Veterans Center,"The Chez Veterans Center ensures that every Illinois student has opportunities for personal and professional growth with special emphasis on leadership and career development, health and wellness, diversity programs, and engagement with the larger community.",https://ahs.illinois.edu/chez-veterans-center,Active,english,PhysicalAccessibility | AccessibleHousing,BenefitsSupport | CareerAdvising | Counseling,BlendedDelivery,veterans | military | support | transition | benefits | health | wellness | counseling | career,same as owner
uiuc_ss_05,Office for Access & Equity (OAE),"The OAE is responsible for administrative processes and practices that support the university’s commitment to equal opportunity, gender equity, and accessibility for all members of the campus community.",https://diversity.illinois.edu/institutional-equity/,Active,english,PhysicalAccessibility,DiversityEquityInclusion,BlendedDelivery,access | equity | inclusion | diversity | accommodations | complaints | harassment,same as owner
uiuc_ss_06,International Student & Scholar Services (ISSS),"ISSS is committed to providing culturally sensitive services of the highest quality. We strive to create an environment that is conducive to a successful educational, personal, and professional experience.",https://isss.illinois.edu/,Active,english,MultipleLanguage,ImmigrationAssistance,BlendedDelivery,international students | scholars | immigration | advising | resources,same as owner
uiuc_ss_07,Counseling Center,"College can be stressful. If you are balancing family, work, financial, and other obligations, it can lead to physical and emotional distress, but you are not alone, we are here to help.",https://counselingcenter.illinois.edu/,Active,english,,Counseling | MentalHealthCounseling,BlendedDelivery,counseling | mental health | stress | support,same as owner
uiuc_ss_08, McKinley Health Center,McKinley Health Center provides comprehensive health services to students.,https://mckinley.illinois.edu/,Active,english,DietaryAccommodation,HealthCare,In-Person,health | medical | clinic | healthcare,same as owner
